{
	"$schema": "http://json-schema.org/draft-07/schema#",
	"title": "Pi Coding Agent Theme",
	"description": "Theme schema for Pi coding agent",
	"type": "object",
	"required": [
		"name",
		"colors"
	],
	"properties": {
		"$schema": {
			"type": "string",
			"description": "JSON schema reference"
		},
		"name": {
			"type": "string",
			"description": "Theme name"
		},
		"vars": {
			"type": "object",
			"description": "Reusable color variables",
			"additionalProperties": {
				"oneOf": [
					{
						"type": "string",
						"description": "Hex color (#RRGGBB), variable reference, or empty string for terminal default"
					},
					{
						"type": "integer",
						"minimum": 0,
						"maximum": 255,
						"description": "256-color palette index (0-255)"
					}
				]
			}
		},
		"colors": {
			"type": "object",
			"description": "Theme color definitions (all required)",
			"required": [
				"accent",
				"border",
				"borderAccent",
				"borderMuted",
				"success",
				"error",
				"warning",
				"muted",
				"dim",
				"text",
				"thinkingText",
				"selectedBg",
				"userMessageBg",
				"userMessageText",
				"customMessageBg",
				"customMessageText",
				"customMessageLabel",
				"toolPendingBg",
				"toolSuccessBg",
				"toolErrorBg",
				"toolDiffAddedBg",
				"toolDiffRemovedBg",
				"toolPanelBg",
				"toolTitle",
				"toolOutput",
				"mdHeading",
				"mdLink",
				"mdLinkUrl",
				"mdCode",
				"mdCodeBlock",
				"mdCodeBlockBorder",
				"mdQuote",
				"mdQuoteBorder",
				"mdHr",
				"mdListBullet",
				"toolDiffAdded",
				"toolDiffRemoved",
				"toolDiffText",
				"toolDiffContext",
				"syntaxComment",
				"syntaxKeyword",
				"syntaxFunction",
				"syntaxVariable",
				"syntaxString",
				"syntaxNumber",
				"syntaxType",
				"syntaxOperator",
				"syntaxPunctuation",
				"thinkingOff",
				"thinkingMinimal",
				"thinkingLow",
				"thinkingMedium",
				"thinkingHigh",
				"thinkingXhigh",
				"bashMode"
			],
			"properties": {
				"accent": {
					"$ref": "#/$defs/colorValue",
					"description": "Primary accent color (logo, selected items, cursor)"
				},
				"border": {
					"$ref": "#/$defs/colorValue",
					"description": "Normal borders"
				},
				"borderAccent": {
					"$ref": "#/$defs/colorValue",
					"description": "Highlighted borders"
				},
				"borderMuted": {
					"$ref": "#/$defs/colorValue",
					"description": "Subtle borders"
				},
				"success": {
					"$ref": "#/$defs/colorValue",
					"description": "Success states"
				},
				"error": {
					"$ref": "#/$defs/colorValue",
					"description": "Error states"
				},
				"warning": {
					"$ref": "#/$defs/colorValue",
					"description": "Warning states"
				},
				"muted": {
					"$ref": "#/$defs/colorValue",
					"description": "Secondary/dimmed text"
				},
				"dim": {
					"$ref": "#/$defs/colorValue",
					"description": "Very dimmed text (more subtle than muted)"
				},
				"text": {
					"$ref": "#/$defs/colorValue",
					"description": "Default text color (usually empty string)"
				},
				"thinkingText": {
					"$ref": "#/$defs/colorValue",
					"description": "Thinking block text color"
				},
				"selectedBg": {
					"$ref": "#/$defs/colorValue",
					"description": "Selected item background"
				},
				"userMessageBg": {
					"$ref": "#/$defs/colorValue",
					"description": "User message background"
				},
				"userMessageText": {
					"$ref": "#/$defs/colorValue",
					"description": "User message text color"
				},
				"customMessageBg": {
					"$ref": "#/$defs/colorValue",
					"description": "Custom message background (hook-injected messages)"
				},
				"customMessageText": {
					"$ref": "#/$defs/colorValue",
					"description": "Custom message text color"
				},
				"customMessageLabel": {
					"$ref": "#/$defs/colorValue",
					"description": "Custom message type label color"
				},
				"toolPendingBg": {
					"$ref": "#/$defs/colorValue",
					"description": "Tool execution box (pending state)"
				},
				"toolSuccessBg": {
					"$ref": "#/$defs/colorValue",
					"description": "Tool execution box (success state)"
				},
				"toolErrorBg": {
					"$ref": "#/$defs/colorValue",
					"description": "Tool execution box (error state)"
				},
				"toolDiffAddedBg": {
					"$ref": "#/$defs/colorValue",
					"description": "Diff added-line background block"
				},
				"toolDiffRemovedBg": {
					"$ref": "#/$defs/colorValue",
					"description": "Diff removed-line background block"
				},
				"toolPanelBg": {
					"$ref": "#/$defs/colorValue",
					"description": "Tool panel background (ipython cells and tool executions)"
				},
				"toolTitle": {
					"$ref": "#/$defs/colorValue",
					"description": "Tool execution box title color"
				},
				"toolOutput": {
					"$ref": "#/$defs/colorValue",
					"description": "Tool execution box output text color"
				},
				"mdHeading": {
					"$ref": "#/$defs/colorValue",
					"description": "Markdown heading text"
				},
				"mdLink": {
					"$ref": "#/$defs/colorValue",
					"description": "Markdown link text"
				},
				"mdLinkUrl": {
					"$ref": "#/$defs/colorValue",
					"description": "Markdown link URL"
				},
				"mdCode": {
					"$ref": "#/$defs/colorValue",
					"description": "Markdown inline code"
				},
				"mdCodeBlock": {
					"$ref": "#/$defs/colorValue",
					"description": "Markdown code block content"
				},
				"mdCodeBlockBorder": {
					"$ref": "#/$defs/colorValue",
					"description": "Markdown code block fences"
				},
				"mdQuote": {
					"$ref": "#/$defs/colorValue",
					"description": "Markdown blockquote text"
				},
				"mdQuoteBorder": {
					"$ref": "#/$defs/colorValue",
					"description": "Markdown blockquote border"
				},
				"mdHr": {
					"$ref": "#/$defs/colorValue",
					"description": "Markdown horizontal rule"
				},
				"mdListBullet": {
					"$ref": "#/$defs/colorValue",
					"description": "Markdown list bullets/numbers"
				},
				"toolDiffAdded": {
					"$ref": "#/$defs/colorValue",
					"description": "Added lines in tool diffs"
				},
				"toolDiffRemoved": {
					"$ref": "#/$defs/colorValue",
					"description": "Removed lines in tool diffs"
				},
				"toolDiffText": {
					"$ref": "#/$defs/colorValue",
					"description": "Diff line content on colored add/remove blocks"
				},
				"toolDiffContext": {
					"$ref": "#/$defs/colorValue",
					"description": "Context lines in tool diffs"
				},
				"syntaxComment": {
					"$ref": "#/$defs/colorValue",
					"description": "Syntax highlighting: comments"
				},
				"syntaxKeyword": {
					"$ref": "#/$defs/colorValue",
					"description": "Syntax highlighting: keywords"
				},
				"syntaxFunction": {
					"$ref": "#/$defs/colorValue",
					"description": "Syntax highlighting: function names"
				},
				"syntaxVariable": {
					"$ref": "#/$defs/colorValue",
					"description": "Syntax highlighting: variable names"
				},
				"syntaxString": {
					"$ref": "#/$defs/colorValue",
					"description": "Syntax highlighting: string literals"
				},
				"syntaxNumber": {
					"$ref": "#/$defs/colorValue",
					"description": "Syntax highlighting: number literals"
				},
				"syntaxType": {
					"$ref": "#/$defs/colorValue",
					"description": "Syntax highlighting: type names"
				},
				"syntaxOperator": {
					"$ref": "#/$defs/colorValue",
					"description": "Syntax highlighting: operators"
				},
				"syntaxPunctuation": {
					"$ref": "#/$defs/colorValue",
					"description": "Syntax highlighting: punctuation"
				},
				"thinkingOff": {
					"$ref": "#/$defs/colorValue",
					"description": "Thinking level border: off"
				},
				"thinkingMinimal": {
					"$ref": "#/$defs/colorValue",
					"description": "Thinking level border: minimal"
				},
				"thinkingLow": {
					"$ref": "#/$defs/colorValue",
					"description": "Thinking level border: low"
				},
				"thinkingMedium": {
					"$ref": "#/$defs/colorValue",
					"description": "Thinking level border: medium"
				},
				"thinkingHigh": {
					"$ref": "#/$defs/colorValue",
					"description": "Thinking level border: high"
				},
				"thinkingXhigh": {
					"$ref": "#/$defs/colorValue",
					"description": "Thinking level border: xhigh"
				},
				"bashMode": {
					"$ref": "#/$defs/colorValue",
					"description": "Editor border color in bash mode"
				},
				"userLabel": {
					"$ref": "#/$defs/colorValue",
					"description": "Label on the user message bubble (`you`) (optional)"
				},
				"assistantLabel": {
					"$ref": "#/$defs/colorValue",
					"description": "The `◆ prime` header of an assistant turn (optional)"
				},
				"assistantGutter": {
					"$ref": "#/$defs/colorValue",
					"description": "The gutter rail beside an assistant turn's lines (optional)"
				},
				"runCardBar": {
					"$ref": "#/$defs/colorValue",
					"description": "Left bar and spinner of the live running card (optional)"
				},
				"runCardWarn": {
					"$ref": "#/$defs/colorValue",
					"description": "Running card accent once the step has been quiet for over a minute (optional)"
				},
				"systemNotice": {
					"$ref": "#/$defs/colorValue",
					"description": "Centered one-line system notices (optional)"
				},
				"chipText": {
					"$ref": "#/$defs/colorValue",
					"description": "Text of the footer running chip (optional)"
				},
				"toastText": {
					"$ref": "#/$defs/colorValue",
					"description": "Text of the footer transient notice chip (optional)"
				},
				"userBubbleBg": {
					"$ref": "#/$defs/colorValue",
					"description": "Background of the user message bubble (optional)"
				},
				"runCardBg": {
					"$ref": "#/$defs/colorValue",
					"description": "Background of the live running card (optional)"
				},
				"runCardWarnBg": {
					"$ref": "#/$defs/colorValue",
					"description": "Background of the running card once quiet for over a minute (optional)"
				},
				"chipBg": {
					"$ref": "#/$defs/colorValue",
					"description": "Background of the footer running chip (optional)"
				},
				"toastBg": {
					"$ref": "#/$defs/colorValue",
					"description": "Background of the footer transient notice chip (optional)"
				},
				"activityText": {
					"$ref": "#/$defs/colorValue",
					"description": "Primary text of the live activity feed and change cards (optional)"
				},
				"activityAccent": {
					"$ref": "#/$defs/colorValue",
					"description": "Accent of the live activity feed: spinner, focus caret, card focus (optional)"
				},
				"memoryAccent": {
					"$ref": "#/$defs/colorValue",
					"description": "Memory card and memory rows (optional)"
				},
				"churnBar": {
					"$ref": "#/$defs/colorValue",
					"description": "Churn bar next to changed files in the change card (optional)"
				},
				"diffAddedText": {
					"$ref": "#/$defs/colorValue",
					"description": "Added lines in inline diffs (optional)"
				},
				"diffRemovedText": {
					"$ref": "#/$defs/colorValue",
					"description": "Removed lines in inline diffs (optional)"
				},
				"diffAddedLineBg": {
					"$ref": "#/$defs/colorValue",
					"description": "Tint behind added lines in inline diffs (optional)"
				},
				"diffRemovedLineBg": {
					"$ref": "#/$defs/colorValue",
					"description": "Tint behind removed lines in inline diffs (optional)"
				},
				"rowFlashBg": {
					"$ref": "#/$defs/colorValue",
					"description": "First step of the highlight a new feed row enters with (optional)"
				},
				"rowFlashFadeBg": {
					"$ref": "#/$defs/colorValue",
					"description": "Second, fainter step of the new-row highlight (optional)"
				},
				"cardFocusBg": {
					"$ref": "#/$defs/colorValue",
					"description": "Background of the focused row in a change or memory card (optional)"
				},
				"boxBorder": {
					"$ref": "#/$defs/colorValue",
					"description": "Border of a turn's timeline box (optional)"
				},
				"boxBorderLive": {
					"$ref": "#/$defs/colorValue",
					"description": "Border of the timeline box while the turn runs (optional)"
				},
				"kindThink": {
					"$ref": "#/$defs/colorValue",
					"description": "Glyph and accent of a thinking step in a turn's timeline (optional)"
				},
				"kindCommand": {
					"$ref": "#/$defs/colorValue",
					"description": "Glyph and accent of a command step in a turn's timeline (optional)"
				},
				"kindRead": {
					"$ref": "#/$defs/colorValue",
					"description": "Glyph and accent of a read or look-up step in a turn's timeline (optional)"
				},
				"kindSubagent": {
					"$ref": "#/$defs/colorValue",
					"description": "Glyph and accent of a subagent step and its report in a turn's timeline (optional)"
				},
				"kindError": {
					"$ref": "#/$defs/colorValue",
					"description": "Glyph and accent of a failed step in a turn's timeline (optional)"
				},
				"kindEdit": {
					"$ref": "#/$defs/colorValue",
					"description": "Glyph and accent of a file change step in a turn's timeline (optional)"
				},
				"kindMemory": {
					"$ref": "#/$defs/colorValue",
					"description": "Glyph and accent of a memory step in a turn's timeline (optional)"
				},
				"kindRecovered": {
					"$ref": "#/$defs/colorValue",
					"description": "Glyph of a recovered mistake in a finished turn's summary (optional)"
				},
				"kindThinkBg": {
					"$ref": "#/$defs/colorValue",
					"description": "Block background of a thinking step (optional)"
				},
				"kindThinkHoverBg": {
					"$ref": "#/$defs/colorValue",
					"description": "Block background of a thinking step under the pointer or keyboard focus (optional)"
				},
				"kindCommandBg": {
					"$ref": "#/$defs/colorValue",
					"description": "Block background of a command step (optional)"
				},
				"kindCommandHoverBg": {
					"$ref": "#/$defs/colorValue",
					"description": "Block background of a command step under the pointer or keyboard focus (optional)"
				},
				"kindReadBg": {
					"$ref": "#/$defs/colorValue",
					"description": "Block background of a read or look-up step (optional)"
				},
				"kindReadHoverBg": {
					"$ref": "#/$defs/colorValue",
					"description": "Block background of a read or look-up step under the pointer or keyboard focus (optional)"
				},
				"kindSubagentBg": {
					"$ref": "#/$defs/colorValue",
					"description": "Block background of a subagent step and its report (optional)"
				},
				"kindSubagentHoverBg": {
					"$ref": "#/$defs/colorValue",
					"description": "Block background of a subagent step and its report under the pointer or keyboard focus (optional)"
				},
				"kindErrorBg": {
					"$ref": "#/$defs/colorValue",
					"description": "Block background of a failed step (optional)"
				},
				"kindErrorHoverBg": {
					"$ref": "#/$defs/colorValue",
					"description": "Block background of a failed step under the pointer or keyboard focus (optional)"
				},
				"kindEditBg": {
					"$ref": "#/$defs/colorValue",
					"description": "Block background of a file change step (optional)"
				},
				"kindEditHoverBg": {
					"$ref": "#/$defs/colorValue",
					"description": "Block background of a file change step under the pointer or keyboard focus (optional)"
				},
				"kindMemoryBg": {
					"$ref": "#/$defs/colorValue",
					"description": "Block background of a memory step (optional)"
				},
				"kindMemoryHoverBg": {
					"$ref": "#/$defs/colorValue",
					"description": "Block background of a memory step under the pointer or keyboard focus (optional)"
				},
				"kindPanelBg": {
					"$ref": "#/$defs/colorValue",
					"description": "Background of an opened step's detail panel (optional)"
				}
			},
			"additionalProperties": false
		},
		"export": {
			"type": "object",
			"description": "Optional colors for HTML export (defaults derived from userMessageBg if not specified)",
			"properties": {
				"pageBg": {
					"$ref": "#/$defs/colorValue",
					"description": "Page background color"
				},
				"cardBg": {
					"$ref": "#/$defs/colorValue",
					"description": "Card/container background color"
				},
				"infoBg": {
					"$ref": "#/$defs/colorValue",
					"description": "Info sections background (system prompt, notices)"
				}
			},
			"additionalProperties": false
		}
	},
	"additionalProperties": false,
	"$defs": {
		"colorValue": {
			"oneOf": [
				{
					"type": "string",
					"description": "Hex color (#RRGGBB), variable reference, or empty string for terminal default"
				},
				{
					"type": "integer",
					"minimum": 0,
					"maximum": 255,
					"description": "256-color palette index (0-255)"
				}
			]
		}
	}
}
