{
	"$schema": "https://raw.githubusercontent.com/earendil-works/pi-mono/main/packages/coding-agent/src/modes/interactive/theme/theme-schema.json",
	"name": "light",
	"vars": {
		"teal": "#5a8080",
		"blue": "#547da7",
		"green": "#588458",
		"red": "#aa5555",
		"yellow": "#9a7326",
		"mediumGray": "#6c6c6c",
		"dimGray": "#767676",
		"lightGray": "#b0b0b0",
		"selectedBg": "#d0d0e0",
		"userMsgBg": "#e8e8e8",
		"toolPendingBg": "#e8e8f0",
		"toolSuccessBg": "#e8f0e8",
		"toolErrorBg": "#f0e8e8",
		"toolDiffAddedBg": "#dafbe1",
		"toolDiffRemovedBg": "#ffebe9",
		"customMsgBg": "#ede7f6"
	},
	"colors": {
		"accent": "teal",
		"border": "blue",
		"borderAccent": "teal",
		"borderMuted": "lightGray",
		"success": "green",
		"error": "red",
		"warning": "yellow",
		"muted": "mediumGray",
		"dim": "dimGray",
		"text": "",
		"thinkingText": "#7a7a7a",

		"selectedBg": "selectedBg",
		"userMessageBg": "userMsgBg",
		"userMessageText": "",
		"customMessageBg": "customMsgBg",
		"customMessageText": "",
		"customMessageLabel": "#7e57c2",
		"toolPendingBg": "toolPendingBg",
		"toolSuccessBg": "toolSuccessBg",
		"toolErrorBg": "toolErrorBg",
		"toolDiffAddedBg": "toolDiffAddedBg",
		"toolDiffRemovedBg": "toolDiffRemovedBg",
		"toolPanelBg": "#ededf2",
		"toolTitle": "",
		"toolOutput": "mediumGray",

		"mdHeading": "#7e57c2",
		"mdLink": "blue",
		"mdLinkUrl": "dimGray",
		"mdCode": "teal",
		"mdCodeBlock": "green",
		"mdCodeBlockBorder": "mediumGray",
		"mdQuote": "mediumGray",
		"mdQuoteBorder": "mediumGray",
		"mdHr": "mediumGray",
		"mdListBullet": "green",

		"toolDiffAdded": "green",
		"toolDiffRemoved": "red",
		"toolDiffText": "#57606a",
		"toolDiffContext": "mediumGray",

		"syntaxComment": "#008000",
		"syntaxKeyword": "#0000FF",
		"syntaxFunction": "#795E26",
		"syntaxVariable": "#001080",
		"syntaxString": "#A31515",
		"syntaxNumber": "#098658",
		"syntaxType": "#267F99",
		"syntaxOperator": "#000000",
		"syntaxPunctuation": "#000000",

		"thinkingOff": "lightGray",
		"thinkingMinimal": "#767676",
		"thinkingLow": "blue",
		"thinkingMedium": "teal",
		"thinkingHigh": "#875f87",
		"thinkingXhigh": "#8b008b",

		"bashMode": "green",
		"userLabel": "#5b47c8",
		"assistantLabel": "#1e8a74",
		"assistantGutter": "#b5ddd4",
		"runCardBar": "#6e5bd1",
		"runCardWarn": "#b36b00",
		"systemNotice": "#7a9b93",
		"chipText": "#4b3aa8",
		"toastText": "#1e7a52",
		"userBubbleBg": "#ece8fb",
		"runCardBg": "#f1eefb",
		"runCardWarnBg": "#fbf1df",
		"chipBg": "#e3ddfb",
		"toastBg": "#ddf3e8",
		"activityText": "#1f1f24",
		"activityAccent": "#1e8a74",
		"memoryAccent": "#6e5bd1",
		"churnBar": "#9fcfc4",
		"diffAddedText": "#1a7f37",
		"diffRemovedText": "#b42318",
		"diffAddedLineBg": "#e6f6ea",
		"diffRemovedLineBg": "#fdecec",
		"rowFlashBg": "#cdeee6",
		"rowFlashFadeBg": "#e8f6f2",
		"cardFocusBg": "#e2f2ee",
		"boxBorder": "#d4d4dc",
		"boxBorderLive": "#b4b4c2",
		"kindThink": "#6e4fcf",
		"kindCommand": "#11867c",
		"kindRead": "#2f73b8",
		"kindSubagent": "#9a6a00",
		"kindError": "#c0392b",
		"kindEdit": "#1f8a4c",
		"kindMemory": "#b83f7a",
		"kindRecovered": "#b36b00",
		"kindThinkBg": "#eeeaf9",
		"kindThinkHoverBg": "#dfd8f4",
		"kindCommandBg": "#e2f0ef",
		"kindCommandHoverBg": "#cbe4e2",
		"kindReadBg": "#e6eef6",
		"kindReadHoverBg": "#d1e0ef",
		"kindSubagentBg": "#f3ede0",
		"kindSubagentHoverBg": "#e9dec7",
		"kindErrorBg": "#f7e7e6",
		"kindErrorHoverBg": "#f1d3d0",
		"kindEditBg": "#e4f1ea",
		"kindEditHoverBg": "#cee5d8",
		"kindMemoryBg": "#f6e8ef",
		"kindMemoryHoverBg": "#efd5e2",
		"kindPanelBg": "#f4f4f7"
	},
	"export": {
		"pageBg": "#f8f8f8",
		"cardBg": "#ffffff",
		"infoBg": "#fffae6"
	}
}
